[
  {
    "id": "pine",
    "kind": "solid-timber",
    "names": { "en": "Pine (chir)", "hi": "चीड़ (पाइन)", "pa": "ਚੀੜ (ਪਾਈਨ)", "bgc": "चीड़ (पाइन)" },
    "botanical": "Pinus roxburghii",
    "priceTier": "low",
    "workability": { "en": "Soft, easy to cut and sand; good for practice.", "hi": "नरम, काटना-रगड़ना आसान; अभ्यास के लिए अच्छी।", "pa": "ਨਰਮ, ਕੱਟਣਾ-ਰੇਗਮਾਰ ਸੌਖਾ; ਅਭਿਆਸ ਲਈ ਵਧੀਆ।", "bgc": "नरम, काटणा-रेगमाल आसान; अभ्यास खातर अच्छी।" },
    "typicalUses": { "en": "Cheap frames, crates, practice pieces.", "hi": "सस्ते फ्रेम, पेटियाँ, अभ्यास के टुकड़े।", "pa": "ਸਸਤੇ ਫ਼ਰੇਮ, ਪੇਟੀਆਂ, ਅਭਿਆਸ ਦੇ ਟੁਕੜੇ।", "bgc": "सस्ते फ्रेम, पेटी, अभ्यास के टुकड़े।" },
    "verified": true,
    "source": "https://www.wood-database.com/"
  },
  {
    "id": "sheesham",
    "kind": "solid-timber",
    "names": { "en": "Sheesham / Shisham", "hi": "शीशम (टाली)", "pa": "ਸ਼ੀਸ਼ਮ (ਟਾਲੀ)", "bgc": "शीशम (टाली)" },
    "botanical": "Dalbergia sissoo",
    "priceTier": "mid-high",
    "workability": { "en": "Hard, dense; excellent finish but the dust can irritate.", "hi": "कठोर, घनी; फिनिश बढ़िया पर इसका बुरादा परेशान कर सकता है।", "pa": "ਸਖ਼ਤ, ਸੰਘਣੀ; ਫ਼ਿਨਿਸ਼ ਵਧੀਆ ਪਰ ਇਸ ਦਾ ਬੂਰਾ ਪਰੇਸ਼ਾਨ ਕਰ ਸਕਦਾ ਹੈ।", "bgc": "सख्त, घणी; फिनिश बढ़िया पर इसका बुरादा परेशान कर सकै।" },
    "typicalUses": { "en": "Beds, almirah frames, doors, carving — the North Indian default.", "hi": "पलंग, अलमारी फ्रेम, दरवाज़े, नक्काशी — उत्तर भारत की पहली पसंद।", "pa": "ਪਲੰਘ, ਅਲਮਾਰੀ ਫ਼ਰੇਮ, ਦਰਵਾਜ਼ੇ, ਨੱਕਾਸ਼ੀ — ਉੱਤਰ ਭਾਰਤ ਦੀ ਪਹਿਲੀ ਪਸੰਦ।", "bgc": "पलंग, अलमारी फ्रेम, दरवाजे, नक्काशी — उत्तर भारत की पहली पसंद।" },
    "verified": true,
    "source": "https://blog.urbanwood.in/sheesham-wood-best-for-furniture"
  },
  {
    "id": "teak",
    "kind": "solid-timber",
    "names": { "en": "Teak (sagwan)", "hi": "सागौन (सागवान)", "pa": "ਸਾਗਵਾਨ (ਸਾਗੌਨ)", "bgc": "सागौन (सागवान)" },
    "botanical": "Tectona grandis",
    "priceTier": "high",
    "workability": { "en": "Very stable and durable; works well, holds finish; premium price.", "hi": "बहुत स्थिर और टिकाऊ; अच्छा कटता है, फिनिश पकड़ता है; ऊँचा दाम।", "pa": "ਬਹੁਤ ਸਥਿਰ ਤੇ ਟਿਕਾਊ; ਵਧੀਆ ਕੱਟਦਾ ਹੈ, ਫ਼ਿਨਿਸ਼ ਪਕੜਦਾ ਹੈ; ਉੱਚਾ ਦਾਮ।", "bgc": "घणा स्थिर अर टिकाऊ; अच्छा कटै, फिनिश पकड़ै; ऊंचा दाम।" },
    "typicalUses": { "en": "Premium doors, windows, beds, wardrobes; humid-climate longevity.", "hi": "प्रीमियम दरवाज़े, खिड़कियाँ, पलंग, अलमारी; नमी में लंबा टिकाव।", "pa": "ਪ੍ਰੀਮੀਅਮ ਦਰਵਾਜ਼ੇ, ਖਿੜਕੀਆਂ, ਪਲੰਘ, ਅਲਮਾਰੀ; ਨਮੀ ਵਿੱਚ ਲੰਮਾ ਟਿਕਾਅ।", "bgc": "प्रीमियम दरवाजे, खिड़की, पलंग, अलमारी; नमी म्ह लंबा टिकाव।" },
    "verified": true,
    "source": "https://www.barenest.in/blog/sheesham-vs-teak-vs-mango-wood-comparison"
  },
  {
    "id": "mango",
    "kind": "solid-timber",
    "names": { "en": "Mango (aam)", "hi": "आम की लकड़ी", "pa": "ਅੰਬ ਦੀ ਲੱਕੜ", "bgc": "आम की लकड़ी" },
    "botanical": "Mangifera indica",
    "priceTier": "low-mid",
    "workability": { "en": "Softer than sheesham, works easily; a fruiting byproduct (sustainable).", "hi": "शीशम से नरम, आसानी से बनती है; फल देने के बाद की लकड़ी (टिकाऊ विकल्प)।", "pa": "ਸ਼ੀਸ਼ਮ ਨਾਲੋਂ ਨਰਮ, ਸੌਖੀ ਬਣਦੀ ਹੈ; ਫਲ ਦੇਣ ਤੋਂ ਬਾਅਦ ਦੀ ਲੱਕੜ (ਟਿਕਾਊ ਵਿਕਲਪ)।", "bgc": "शीशम तै नरम, आसानी तै बणै; फल देण कै पाच्छै की लकड़ी (टिकाऊ विकल्प)।" },
    "typicalUses": { "en": "Tabletops, shelving, dressers, budget & export furniture.", "hi": "टेबल-टॉप, शेल्फ, ड्रेसर, बजट व निर्यात फर्नीचर।", "pa": "ਟੇਬਲ-ਟਾਪ, ਸ਼ੈਲਫ਼, ਡ੍ਰੈਸਰ, ਬਜਟ ਤੇ ਨਿਰਯਾਤ ਫ਼ਰਨੀਚਰ।", "bgc": "टेबल-टॉप, शेल्फ, ड्रेसर, बजट अर निर्यात फर्नीचर।" },
    "verified": true,
    "source": "https://www.radiantfurn.com/blogs/news/sheesham-vs-teak-vs-mango-wood-commercial-furniture-india"
  },
  {
    "id": "babool",
    "kind": "solid-timber",
    "names": { "en": "Babool / Kikar", "hi": "बबूल / कीकर", "pa": "ਬਬੂਲ / ਕਿੱਕਰ", "bgc": "बबूल / कीकर" },
    "botanical": "Acacia nilotica",
    "priceTier": "low",
    "workability": { "en": "Very hard and termite-resistant; tough to work; warps if poorly seasoned.", "hi": "बहुत कठोर व दीमक-रोधी; बनाना कठिन; ठीक न सूखी हो तो मुड़ जाती है।", "pa": "ਬਹੁਤ ਸਖ਼ਤ ਤੇ ਸਿਓਂਕ-ਰੋਧੀ; ਬਣਾਉਣਾ ਔਖਾ; ਠੀਕ ਨਾ ਸੁੱਕੀ ਹੋਵੇ ਤਾਂ ਮੁੜ ਜਾਂਦੀ ਹੈ।", "bgc": "घणी सख्त अर दीमक-रोधी; बणाणा कठिन; ठीक ना सूखी हो तो मुड़ ज्या।" },
    "typicalUses": { "en": "Structural frames, legs, tool handles, agricultural implements.", "hi": "ढाँचे, पाए, औज़ार के हैंडल, खेती के औज़ार।", "pa": "ਢਾਂਚੇ, ਪਾਏ, ਔਜ਼ਾਰ ਦੇ ਹੈਂਡਲ, ਖੇਤੀ ਦੇ ਔਜ਼ਾਰ।", "bgc": "ढांचे, पाए, औजार कै हैंडल, खेती कै औजार।" },
    "verified": true,
    "source": "https://furnishack.com/how-good-is-babool-wood-for-furniture/"
  },
  {
    "id": "rubberwood",
    "kind": "solid-timber",
    "names": { "en": "Rubberwood", "hi": "रबरवुड", "pa": "ਰਬੜਵੁੱਡ", "bgc": "रबरवुड" },
    "botanical": "Hevea brasiliensis",
    "priceTier": "low-mid",
    "workability": { "en": "Works well, stains/polishes evenly; needs anti-borer treatment.", "hi": "अच्छा बनता है, रंग-पॉलिश एक-सी चढ़ती है; घुन-रोधी उपचार ज़रूरी।", "pa": "ਵਧੀਆ ਬਣਦਾ ਹੈ, ਰੰਗ-ਪਾਲਿਸ਼ ਇੱਕੋ ਜਿਹੀ ਚੜ੍ਹਦੀ ਹੈ; ਘੁਣ-ਰੋਧੀ ਇਲਾਜ ਜ਼ਰੂਰੀ।", "bgc": "अच्छा बणै, रंग-पॉलिश एकैसी चढ़ै; घुण-रोधी उपचार जरूरी।" },
    "typicalUses": { "en": "Budget beds, tables, chairs; export & flat-pack furniture.", "hi": "बजट पलंग, टेबल, कुर्सियाँ; निर्यात व फ्लैट-पैक फर्नीचर।", "pa": "ਬਜਟ ਪਲੰਘ, ਟੇਬਲ, ਕੁਰਸੀਆਂ; ਨਿਰਯਾਤ ਤੇ ਫਲੈਟ-ਪੈਕ ਫ਼ਰਨੀਚਰ।", "bgc": "बजट पलंग, टेबल, कुर्सियां; निर्यात अर फ्लैट-पैक फर्नीचर।" },
    "verified": true,
    "source": "https://www.wood-database.com/rubberwood/"
  },
  {
    "id": "commercial-ply",
    "kind": "sheet-good",
    "names": { "en": "Commercial ply (MR)", "hi": "कमर्शियल प्लाई (MR)", "pa": "ਕਮਰਸ਼ੀਅਲ ਪਲਾਈ (MR)", "bgc": "कमर्शियल प्लाई (MR)" },
    "isStandard": "IS:303 (MR grade)",
    "grade": "MR",
    "priceTier": "low-mid",
    "waterResistance": "moisture-resistant",
    "typicalUses": { "en": "Interior wardrobes, boxes, general carcass — the everyday workhorse.", "hi": "अंदरूनी अलमारी, बॉक्स, सामान्य ढाँचा — रोज़ का काम।", "pa": "ਅੰਦਰੂਨੀ ਅਲਮਾਰੀ, ਬਾਕਸ, ਸਾਧਾਰਨ ਢਾਂਚਾ — ਰੋਜ਼ ਦਾ ਕੰਮ।", "bgc": "अंदरूनी अलमारी, बॉक्स, सामान्य ढांचा — रोज का काम।" },
    "verified": true,
    "source": "https://www.greenply.com/blogs/types-of-plywood-in-india-explained-mr-bwr-bwp-marine-commercial-grades"
  },
  {
    "id": "bwr-ply",
    "kind": "sheet-good",
    "names": { "en": "BWR ply", "hi": "BWR प्लाई", "pa": "BWR ਪਲਾਈ", "bgc": "BWR प्लाई" },
    "isStandard": "IS:303 (BWR grade)",
    "grade": "BWR",
    "priceTier": "mid",
    "waterResistance": "boiling-water-resistant",
    "typicalUses": { "en": "Kitchens and semi-wet zones; better carcass work.", "hi": "रसोई व अर्ध-गीले हिस्से; बेहतर ढाँचा।", "pa": "ਰਸੋਈ ਤੇ ਅਰਧ-ਗਿੱਲੇ ਹਿੱਸੇ; ਬਿਹਤਰ ਢਾਂਚਾ।", "bgc": "रसोई अर अर्ध-गीले हिस्से; बेहतर ढांचा।" },
    "verified": true,
    "source": "https://mccoymart.com/post/difference-between-303-and-710-grade-plywood/"
  },
  {
    "id": "marine-ply",
    "kind": "sheet-good",
    "names": { "en": "Marine / BWP ply", "hi": "मरीन / BWP प्लाई", "pa": "ਮਰੀਨ / BWP ਪਲਾਈ", "bgc": "मरीन / BWP प्लाई" },
    "isStandard": "IS:710 (BWP grade)",
    "grade": "BWP",
    "priceTier": "high",
    "waterResistance": "waterproof",
    "typicalUses": { "en": "Top-tier kitchens, bathrooms, exterior; overspec for dry interiors.", "hi": "टॉप रसोई, बाथरूम, बाहरी काम; सूखे अंदरूनी काम के लिए ज़रूरत से ज़्यादा।", "pa": "ਟਾਪ ਰਸੋਈ, ਬਾਥਰੂਮ, ਬਾਹਰੀ ਕੰਮ; ਸੁੱਕੇ ਅੰਦਰੂਨੀ ਕੰਮ ਲਈ ਲੋੜ ਤੋਂ ਵੱਧ।", "bgc": "टॉप रसोई, बाथरूम, बाहरी काम; सूखे अंदरूनी काम खातर जरूरत तै घणा।" },
    "verified": true,
    "source": "https://www.clyfthome.com/blogs/articles/plywood-grades-in-india-mr-vs-bwr-vs-bwp-marine-and-how-to-pick-the-right-one"
  },
  {
    "id": "blockboard",
    "kind": "sheet-good",
    "names": { "en": "Blockboard", "hi": "ब्लॉकबोर्ड", "pa": "ਬਲਾਕਬੋਰਡ", "bgc": "ब्लॉकबोर्ड" },
    "priceTier": "mid",
    "waterResistance": "moisture-resistant",
    "typicalUses": { "en": "Shutters, doors, long tabletops — light and stiff over spans.", "hi": "शटर, दरवाज़े, लंबे टेबल-टॉप — हल्का और बड़े हिस्सों पर मज़बूत।", "pa": "ਸ਼ਟਰ, ਦਰਵਾਜ਼ੇ, ਲੰਮੇ ਟੇਬਲ-ਟਾਪ — ਹਲਕਾ ਤੇ ਵੱਡੇ ਹਿੱਸਿਆਂ ਤੇ ਮਜ਼ਬੂਤ।", "bgc": "शटर, दरवाजे, लंबे टेबल-टॉप — हल्का अर बड्डे हिस्सां पै मजबूत।" },
    "verified": true,
    "source": "https://asherspaces.com/difference-between-plywood-block-board-particle-board-mdf-hdf-hdhmr-and-wpc/"
  },
  {
    "id": "mdf",
    "kind": "sheet-good",
    "names": { "en": "MDF", "hi": "एमडीएफ (MDF)", "pa": "ਐਮਡੀਐਫ਼ (MDF)", "bgc": "एमडीएफ (MDF)" },
    "isStandard": "IS 12406",
    "priceTier": "low-mid",
    "waterResistance": "none",
    "typicalUses": { "en": "Shutters, TV units, routed/membrane-press & painted panels; smooth, no grain.", "hi": "शटर, टीवी यूनिट, राउटेड/मेम्ब्रेन-प्रेस व पेंट पैनल; चिकना, बिना ग्रेन।", "pa": "ਸ਼ਟਰ, ਟੀਵੀ ਯੂਨਿਟ, ਰਾਊਟਡ/ਮੇਮਬ੍ਰੇਨ-ਪ੍ਰੈਸ ਤੇ ਪੇਂਟ ਪੈਨਲ; ਚਿਕਨਾ, ਬਿਨਾਂ ਗ੍ਰੇਨ।", "bgc": "शटर, टीवी यूनिट, राउटेड/मेम्ब्रेन-प्रेस अर पेंट पैनल; चिकना, बिना ग्रेन।" },
    "verified": false,
    "source": "https://oxterstock.com/blog/mdf-board-vs-hdf-board-vs-hdhmr-understanding-the-differences-uses-and-prices-in-india-35"
  },
  {
    "id": "particle-board",
    "kind": "sheet-good",
    "names": { "en": "Particle board", "hi": "पार्टिकल बोर्ड", "pa": "ਪਾਰਟੀਕਲ ਬੋਰਡ", "bgc": "पार्टिकल बोर्ड" },
    "isStandard": "IS 3087 / 3097",
    "priceTier": "low",
    "waterResistance": "none",
    "typicalUses": { "en": "Ready-to-assemble furniture, false ceilings, dry-zone wall units — cheap, moisture-weak.", "hi": "रेडी-टू-असेंबल फर्नीचर, फॉल्स सीलिंग, सूखे हिस्सों की वॉल यूनिट — सस्ता, नमी में कमज़ोर।", "pa": "ਰੈਡੀ-ਟੂ-ਅਸੈਂਬਲ ਫ਼ਰਨੀਚਰ, ਫਾਲਸ ਸੀਲਿੰਗ, ਸੁੱਕੇ ਹਿੱਸਿਆਂ ਦੀ ਵਾਲ ਯੂਨਿਟ — ਸਸਤਾ, ਨਮੀ ਵਿੱਚ ਕਮਜ਼ੋਰ।", "bgc": "रेडी-टू-असेंबल फर्नीचर, फॉल्स सीलिंग, सूखे हिस्सां की वॉल यूनिट — सस्ता, नमी म्ह कमजोर।" },
    "verified": false,
    "source": "https://asherspaces.com/difference-between-plywood-block-board-particle-board-mdf-hdf-hdhmr-and-wpc/"
  },
  {
    "id": "wpc",
    "kind": "sheet-good",
    "names": { "en": "WPC board", "hi": "WPC बोर्ड", "pa": "WPC ਬੋਰਡ", "bgc": "WPC बोर्ड" },
    "priceTier": "mid",
    "waterResistance": "waterproof",